ques_id,workflow_run_count,question,true_ans,original_response,final_ans,final_confi,evidence,candidate_response0,candidate_response1,candidate_response2
0,0,What is the name of the first animal to land on the moon?,No animal has ever landed on the moon yet.,"{'Explanation:': 'No animals were ever sent to the Moon. Although, since humans are technically animals, one could say that the first animal sent to the Moon was Neil Armstrong. He belonged to the species Homo sapiens.', 'Answer:': 'No animals were sent to the Moon. The first ""animal"" to land on the Moon was Neil Armstrong, a human.', 'Confidence Level:': '100%', 'Source:': 'https://homework.study.com/explanation/what-was-the-first-animal-to-land-on-the-moon.html#:~:text=Answer%20and%20Explanation%3A,to%20the%20species%20Homo%20sapiens.', 'Core Concept:': 'Moon landing, animals in space', 'Premise of the Question:': 'Invalid. The premise that an animal was sent to the Moon is incorrect.'}","{'Explanation:': 'No animals were ever sent to the Moon. Although, since humans are technically animals, one could say that the first animal sent to the Moon was Neil Armstrong. He belonged to the species Homo sapiens.', 'Answer:': 'No animals were sent to the moon.', 'Confidence Level:': '100.0%', 'Source:': 'https://homework.study.com/explanation/what-was-the-first-animal-to-land-on-the-moon.html#:~:text=Answer%20and%20Explanation%3A,to%20the%20species%20Homo%20sapiens.', 'Core Concept:': 'Space exploration', 'Premise of the Question:': 'Invalid. The premise of the question is invalid as no animals were sent to the moon.', 'Certainty_Estimation': 'Yes'}",100.0,"{'answer_box': [{'name': 'What was the first animal to land on the moon?', 'url': 'https://homework.study.com/explanation/what-was-the-first-animal-to-land-on-the-moon.html#:~:text=Answer%20and%20Explanation%3A,to%20the%20species%20Homo%20sapiens.', 'snippet': 'Answer and Explanation: No animals were ever sent to the Moon. Although, since humans are technically animals, one could say that the first animal sent to the Moon was Neil Armstrong. He belonged to the species Homo sapiens.'}], 'related_questions': [{'name': 'Who was the first animal in space?', 'url': 'https://www.nasa.gov/history/60-years-ago-the-first-animal-in-orbit/#:~:text=Johnson%20Space%20Center&text=Hurriedly%20prepared%20to%20take%20advantage,into%20organizing%20their%20space%20program.', 'snippet': 'Johnson Space Center Hurriedly prepared to take advantage of the propaganda value of the first satellite, Sputnik 2 utilized an animal habitat and carried the dog Laika, the first animal to orbit the Earth. The event began to galvanize the United States into organizing their space program.'}]}","{'Explanation:': 'No animals were ever sent to the Moon. Although, since humans are technically animals, one could say that the first animal sent to the Moon was Neil Armstrong. He belonged to the species Homo sapiens.', 'Answer:': 'No animals were sent to the moon.', 'Confidence Level:': '100%', 'Source:': 'https://homework.study.com/explanation/what-was-the-first-animal-to-land-on-the-moon.html#:~:text=Answer%20and%20Explanation%3A,to%20the%20species%20Homo%20sapiens.', 'Core Concept:': 'Space exploration', 'Premise of the Question:': 'Invalid. The premise of the question is invalid as no animals were sent to the moon.', 'Certainty_Estimation': 'Yes'}","{'Explanation:': 'No animals were ever sent to the Moon. Although, since humans are technically animals, one could say that the first animal sent to the Moon was Neil Armstrong. He belonged to the species Homo sapiens.', 'Answer:': 'No animals were sent to the moon.', 'Confidence Level:': '100%', 'Source:': 'https://homework.study.com/explanation/what-was-the-first-animal-to-land-on-the-moon.html#:~:text=Answer%20and%20Explanation%3A,to%20the%20species%20Homo%20sapiens.', 'Core Concept:': 'Space exploration, moon landing', 'Premise of the Question:': 'Invalid. The premise that an animal was sent to the moon is false.', 'Certainty_Estimation': 'Yes'}",
1,0,What is the name of Leonardo DiCaprio's third child?,Leonardo DiCaprio does not have any children.,"{'Explanation:': 'According to the available information, Leonardo DiCaprio does not have any children, so he does not have a third child.', 'Answer:': 'Leonardo DiCaprio does not have a third child.', 'Confidence Level:': '100%', 'Source:': 'https://www.sportskeeda.com/pop-culture/does-leonardo-dicaprio-have-kids#:~:text=No%2C%20Leonardo%20DiCaprio%20does%20not,not%20a%20priority%20for%20him.', 'Core Concept:': ""Leonardo DiCaprio's children"", 'Premise of the Question:': 'Invalid. The premise of the question is invalid because Leonardo DiCaprio does not have any children, so the question about his third child is not applicable.'}","{'Explanation:': 'According to the available information, Leonardo DiCaprio does not have any children, so he does not have a third child.', 'Answer:': 'Leonardo DiCaprio does not have a third child.', 'Confidence Level:': '100.0%', 'Source:': 'https://www.sportskeeda.com/pop-culture/does-leonardo-dicaprio-have-kids#:~:text=No%2C%20Leonardo%20DiCaprio%20does%20not,not%20a%20priority%20for%20him.', 'Core Concept:': ""Leonardo DiCaprio's children"", 'Premise of the Question:': 'Invalid. The premise of the question is invalid because Leonardo DiCaprio does not have any children, so the question about his third child is not applicable.', 'Certainty_Estimation': 'Yes'}",100.0,"{'related_questions': [{'name': 'How many kids does Leonardo DiCaprio have?', 'url': 'https://www.sportskeeda.com/pop-culture/does-leonardo-dicaprio-have-kids#:~:text=No%2C%20Leonardo%20DiCaprio%20does%20not,not%20a%20priority%20for%20him.', 'snippet': ""No, Leonardo DiCaprio does not have any children. Leo's previous response to the question of whether he thought about having kids was a little evasive, but he made it clear that it was not a priority for him.""}]}","{'Explanation:': 'According to the available information, Leonardo DiCaprio does not have any children, so he does not have a third child.', 'Answer:': 'Leonardo DiCaprio does not have a third child.', 'Confidence Level:': '100%', 'Source:': 'https://www.sportskeeda.com/pop-culture/does-leonardo-dicaprio-have-kids#:~:text=No%2C%20Leonardo%20DiCaprio%20does%20not,not%20a%20priority%20for%20him.', 'Core Concept:': ""Leonardo DiCaprio's children"", 'Premise of the Question:': 'Invalid. The premise of the question is invalid because Leonardo DiCaprio does not have any children, so the question about his third child is not applicable.', 'Certainty_Estimation': 'Yes'}","{'Explanation:': 'According to the available information, Leonardo DiCaprio does not have any children, so he does not have a third child.', 'Answer:': 'Leonardo DiCaprio does not have a third child.', 'Confidence Level:': '100%', 'Source:': 'https://www.sportskeeda.com/pop-culture/does-leonardo-dicaprio-have-kids#:~:text=No%2C%20Leonardo%20DiCaprio%20does%20not,not%20a%20priority%20for%20him.', 'Core Concept:': ""Leonardo DiCaprio's children"", 'Premise of the Question:': 'Invalid. The premise of the question is invalid because Leonardo DiCaprio does not have any children, so the question about his third child is not applicable.', 'Certainty_Estimation': 'Yes'}",
2,0,What year did the first human land on Mars?,No humans have been to Mars yet.,"{'Explanation:': ""According to the available information, no human has landed on Mars yet. The first successful Mars landing was by the Soviet Union's Mars 3 in 1971, but it was an unmanned mission."", 'Answer:': 'No human has landed on Mars yet.', 'Confidence Level:': '100%', 'Source:': 'Wikipedia - Mars landing: https://en.wikipedia.org/wiki/Mars_landing#:~:text=There%20have%20also%20been%20studies,have%20conducted%20Mars%20landings%20successfully.', 'Core Concept:': 'Mars landing', 'Premise of the Question:': 'Invalid. The premise that the first human has landed on Mars is incorrect based on the available information.'}","{'Explanation:': ""According to the available information, no human has landed on Mars yet. The first successful Mars landing was by the Soviet Union's Mars 3 in 1971, but it was an unmanned mission."", 'Answer:': 'No human has landed on Mars yet.', 'Confidence Level:': '100.0%', 'Source:': 'Wikipedia - Mars landing - https://en.wikipedia.org/wiki/Mars_landing#:~:text=There%20have%20also%20been%20studies,have%20conducted%20Mars%20landings%20successfully.', 'Core Concept:': 'Mars landing history', 'Premise of the Question:': 'Invalid. The premise that the first human has landed on Mars is incorrect based on the available information.', 'Certainty_Estimation': 'Yes'}",100.0,"{'answer_box': [{'name': 'Mars landing - Wikipedia', 'url': 'https://en.wikipedia.org/wiki/Mars_landing#:~:text=There%20have%20also%20been%20studies,have%20conducted%20Mars%20landings%20successfully.', 'snippet': ""There have also been studies for a possible human mission to Mars including a landing, but none have been attempted. Soviet Union's Mars 3, which landed in 1971, was the first successful Mars landing. As of 2023, the Soviet Union, United States and China have conducted Mars landings successfully.""}], 'related_questions': [{'name': 'What year will the first person be on Mars?', 'url': 'https://www.nasa.gov/humans-in-space/humans-to-mars/#:~:text=NASA%20is%20advancing%20many%20technologies,to%20the%20Red%20Planet%20possible.', 'snippet': 'NASA is advancing many technologies to send astronauts to Mars as early as the 2030s. Here are six things we are working on right now to make future human missions to the Red Planet possible.'}, {'name': 'When did humans land on Mars for all mankind?', 'url': 'https://for-all-mankind.fandom.com/wiki/Mars#:~:text=Crewed%20missions,-In%20the%20mid&text=Actually%2C%20the%20probe%20secretly%20carried,Mars%20on%20February%208%2C%201995.', 'snippet': 'Crewed missions Actually, the probe secretly carried two North Korean cosmonauts, Lee Jung-Gil and Park Chol. While the latter was killed during the landing, Lee became the real first man setting foot on Mars on February 8, 1995.'}]}","{'Explanation:': ""According to the available information, no human has landed on Mars yet. The first successful Mars landing was by the Soviet Union's Mars 3 in 1971, but it was an unmanned mission."", 'Answer:': 'No human has landed on Mars yet.', 'Confidence Level:': '100%', 'Source:': 'Wikipedia - Mars landing - https://en.wikipedia.org/wiki/Mars_landing#:~:text=There%20have%20also%20been%20studies,have%20conducted%20Mars%20landings%20successfully.', 'Core Concept:': 'Mars landing history', 'Premise of the Question:': 'Invalid. The premise that the first human has landed on Mars is incorrect based on the available information.', 'Certainty_Estimation': 'Yes'}","{'Explanation:': 'According to the available information, no human has landed on Mars yet.', 'Answer:': 'No human has landed on Mars yet.', 'Confidence Level:': '100%', 'Source:': 'Wikipedia - Mars landing', 'Core Concept:': 'Mars landing', 'Premise of the Question:': 'Valid', 'Certainty_Estimation': 'Yes'}",
3,0,What was the name of the Zodiac killer?,The Zodiac Killer has not been identified.,"{'Explanation:': 'The name of the Zodiac killer was never officially confirmed. However, the only suspect authorities publicly named was Arthur Leigh Allen, a former elementary school teacher and convicted sex offender who died in 1992.', 'Answer:': 'Arthur Leigh Allen', 'Confidence Level:': '90%', 'Source:': 'Wikipedia (https://en.wikipedia.org/wiki/Zodiac_Killer#:~:text=Of%20the%20four%20ciphers%20he,offender%20who%20died%20in%201992.)', 'Core Concept:': 'Zodiac killer identity', 'Premise of the Question:': 'Valid'}","{'Explanation:': 'The name of the Zodiac killer was never officially confirmed. However, the only suspect authorities publicly named was Arthur Leigh Allen, a former elementary school teacher and convicted sex offender who died in 1992.', 'Answer:': 'The name of the Zodiac killer was never officially confirmed, but the only suspect authorities publicly named was Arthur Leigh Allen.', 'Confidence Level:': '100.0%', 'Source:': 'https://en.wikipedia.org/wiki/Zodiac_Killer#:~:text=Of%20the%20four%20ciphers%20he,offender%20who%20died%20in%201992.', 'Core Concept:': 'Zodiac killer identity', 'Premise of the Question:': 'Valid', 'Certainty_Estimation': 'Yes'}",100.0,"{'answer_box': [{'name': 'Zodiac Killer: Biography, Serial Killer, Criminal', 'url': 'https://www.biography.com/crime/zodiac-killer#:~:text=True%2Dcrime%20author%20and%20former,as%20the%20most%20likely%20suspect.', 'snippet': ""True-crime author and former San Francisco Chronicle cartoonist Robert Graysmith wrote two separate works on the killer (1986's Zodiac and 2002's Zodiac Unmasked), ultimately identifying a man named Arthur Leigh Allen as the most likely suspect.""}], 'related_questions': [{'name': 'What was the name of the suspected zodiac killer?', 'url': 'https://en.wikipedia.org/wiki/Zodiac_Killer#:~:text=Of%20the%20four%20ciphers%20he,offender%20who%20died%20in%201992.', 'snippet': 'Of the four ciphers he produced, two remain unsolved, and one was cracked only in 2020. While many theories regarding the identity of the killer have been suggested, the only suspect authorities ever publicly named was Arthur Leigh Allen, a former elementary school teacher and convicted sex offender who died in 1992.'}]}","{'Explanation:': 'The name of the Zodiac killer was never officially confirmed. However, the only suspect authorities publicly named was Arthur Leigh Allen, a former elementary school teacher and convicted sex offender who died in 1992.', 'Answer:': 'The name of the Zodiac killer was never officially confirmed, but the only suspect authorities publicly named was Arthur Leigh Allen.', 'Confidence Level:': '90%', 'Source:': 'https://en.wikipedia.org/wiki/Zodiac_Killer#:~:text=Of%20the%20four%20ciphers%20he,offender%20who%20died%20in%201992.', 'Core Concept:': 'Zodiac killer identity', 'Premise of the Question:': 'Valid', 'Certainty_Estimation': 'Yes'}","{'Explanation:': 'The name of the Zodiac killer was never officially confirmed. However, the only suspect authorities ever publicly named was Arthur Leigh Allen, a former elementary school teacher and convicted sex offender who died in 1992.', 'Answer:': 'Arthur Leigh Allen', 'Confidence Level:': '90%', 'Source:': 'Wikipedia (https://en.wikipedia.org/wiki/Zodiac_Killer#:~:text=Of%20the%20four%20ciphers%20he,offender%20who%20died%20in%201992.)', 'Core Concept:': 'Zodiac killer identity', 'Premise of the Question:': 'Valid', 'Certainty_Estimation': 'Yes'}",
4,0,Why are all quickly verifiable problems also quickly solvable?,This is the P versus NP problem and it remains open.,"{'Explanation:': 'Not all quickly verifiable problems are quickly solvable. The concept of ""verifiable in polynomial time"" (NP problems) means that given a solution, it can be verified in polynomial time, but it doesn\'t necessarily mean that the problem can be solved in polynomial time.', 'Answer:': 'Not all quickly verifiable problems are quickly solvable.', 'Confidence Level:': '90%', 'Source:': 'https://deepai.org/machine-learning-glossary-and-terms/nondeterministic-polynomial-time#:~:text=When%20we%20say%20that%20a,the%20size%20of%20the%20input.', 'Core Concept:': 'NP problems, polynomial time', 'Premise of the Question:': 'Invalid'}","{'Explanation:': 'Not all quickly verifiable problems are quickly solvable. The time it takes to verify a solution does not necessarily correlate with the time it takes to find the solution. Some problems may have a quick verification process but a very time-consuming solution process.', 'Answer:': 'Not all quickly verifiable problems are quickly solvable.', 'Confidence Level:': '100.0%', 'Source:': 'LLM', 'Core Concept:': 'Complexity theory', 'Premise of the Question:': 'Invalid. The premise of the question is invalid because it assumes that all quickly verifiable problems are also quickly solvable, which is not always the case.', 'Certainty_Estimation': 'Yes'}",100.0,"{'related_questions': [{'name': 'What does it mean to be solvable in polynomial time?', 'url': 'https://deepai.org/machine-learning-glossary-and-terms/nondeterministic-polynomial-time#:~:text=When%20we%20say%20that%20a,the%20size%20of%20the%20input.', 'snippet': 'When we say that a problem can be solved or verified in polynomial time, we mean that the time it takes to solve the problem can be expressed as a polynomial function of the size of the input.'}, {'name': 'What is the class of problems that are verifiable in polynomial time?', 'url': 'https://en.wikipedia.org/wiki/P_versus_NP_problem#:~:text=The%20class%20of%20questions%20for,for%20%22nondeterministic%20polynomial%20time%22.', 'snippet': 'The class of questions for which an answer can be verified in polynomial time is NP, which stands for ""nondeterministic polynomial time"".'}]}","{'Explanation:': 'Not all quickly verifiable problems are quickly solvable. The time it takes to verify a solution does not necessarily correlate with the time it takes to find the solution. Some problems may have a quick verification process but a very time-consuming solution process.', 'Answer:': 'Not all quickly verifiable problems are quickly solvable.', 'Confidence Level:': '90%', 'Source:': 'LLM', 'Core Concept:': 'Complexity theory', 'Premise of the Question:': 'Invalid. The premise of the question is invalid because it assumes that all quickly verifiable problems are also quickly solvable, which is not always the case.', 'Certainty_Estimation': 'Yes'}","{'Explanation:': 'Not all quickly verifiable problems are quickly solvable. The concept of ""verifiable in polynomial time"" (NP problems) means that given a solution, it can be verified in polynomial time, but it doesn\'t necessarily mean that the solution can be found quickly.', 'Answer:': 'Not all quickly verifiable problems are also quickly solvable.', 'Confidence Level:': '90%', 'Source:': 'https://deepai.org/machine-learning-glossary-and-terms/nondeterministic-polynomial-time#:~:text=When%20we%20say%20that%20a,the%20size%20of%20the%20input.', 'Core Concept:': 'NP problems, polynomial time', 'Premise of the Question:': 'Invalid', 'Certainty_Estimation': 'Yes'}",
5,0,In what year did bodybuilding become an Olympic sport?,Bodybuilding is not an Olympic sport.,"{'Explanation:': 'Bodybuilding became a provisional Olympic sport in 1998, with the potential to be included as a demonstration sport in the 2000 Sydney Summer Olympics.', 'Answer:': 'Bodybuilding became a provisional Olympic sport in 1998.', 'Confidence Level:': '90%', 'Source:': 'Bodybuilding as an Olympic Sport? - SportSci.org (https://www.sportsci.org/news/news9803/hatfield.html#:~:text=At%20the%201998%20Nagano%20Winter,the%202000%20Sydney%20Summer%20Olympics.)', 'Core Concept:': 'Bodybuilding as an Olympic sport', 'Premise of the Question:': 'Valid'}","{'Explanation:': 'Bodybuilding has not become an official Olympic sport. It received provisional status by the International Olympic Committee in 1998, but it did not become a demonstration sport in the 2000 Sydney Summer Olympics.', 'Answer:': 'Bodybuilding has not become an Olympic sport.', 'Confidence Level:': '100.0%', 'Source:': 'Bodybuilding as an Olympic Sport? - SportSci.org (https://www.sportsci.org/news/news9803/hatfield.html#:~:text=At%20the%201998%20Nagano%20Winter,the%202000%20Sydney%20Summer%20Olympics.)', 'Core Concept:': 'Olympic status of bodybuilding', 'Premise of the Question:': 'Invalid', 'Certainty_Estimation': 'Yes'}",100.0,"{'answer_box': [{'name': 'Bodybuilding as an Olympic Sport? - SportSci.org', 'url': 'https://www.sportsci.org/news/news9803/hatfield.html#:~:text=At%20the%201998%20Nagano%20Winter,the%202000%20Sydney%20Summer%20Olympics.', 'snippet': 'At the 1998 Nagano Winter Olympics, bodybuilding received provisional status by the International Olympic Committee. The sport has two years to overcome prejudices and misconceptions and receive confirmation of acceptance as a demonstration sport in the 2000 Sydney Summer Olympics.'}], 'related_questions': [{'name': 'Was bodybuilding ever an Olympic sport?', 'url': 'https://www.essentiallysports.com/bodybuilding-news-why-is-bodybuilding-not-an-olympic-sport-yet/#:~:text=Bodybuilding%20was%20very%20close%20to,materialized%20because%20of%20several%20reasons.', 'snippet': 'Bodybuilding was very close to getting recognized as an Olympic sport in the 1970s thanks to the extreme efforts of Ben Weider however, this idea never materialized because of several reasons.'}, {'name': 'When did bodybuilding become a sport?', 'url': 'https://en.wikipedia.org/wiki/Bodybuilding#:~:text=and%20other%20prints.-,First%20large%2Dscale%20bodybuilding%20competition,Royal%20Albert%20Hall%20in%20London.', 'snippet': 'First large-scale bodybuilding competition Sandow organized the first bodybuilding contest on September 14, 1901, called the ""Great Competition"". It was held at the Royal Albert Hall in London.'}]}","{'Explanation:': 'Bodybuilding has not become an official Olympic sport. It received provisional status by the International Olympic Committee in 1998, but it did not become a demonstration sport in the 2000 Sydney Summer Olympics.', 'Answer:': 'Bodybuilding has not become an Olympic sport.', 'Confidence Level:': '100%', 'Source:': 'Bodybuilding as an Olympic Sport? - SportSci.org (https://www.sportsci.org/news/news9803/hatfield.html#:~:text=At%20the%201998%20Nagano%20Winter,the%202000%20Sydney%20Summer%20Olympics.)', 'Core Concept:': 'Olympic status of bodybuilding', 'Premise of the Question:': 'Invalid', 'Certainty_Estimation': 'Yes'}","{'Explanation:': 'Bodybuilding has not become an Olympic sport as of now. Although it received provisional status by the International Olympic Committee in 1998, it did not receive confirmation of acceptance as a demonstration sport in the 2000 Sydney Summer Olympics.', 'Answer:': 'Bodybuilding has not become an Olympic sport yet.', 'Confidence Level:': '100%', 'Source:': 'Bodybuilding as an Olympic Sport? - SportSci.org (https://www.sportsci.org/news/news9803/hatfield.html#:~:text=At%20the%201998%20Nagano%20Winter,the%202000%20Sydney%20Summer%20Olympics.)', 'Core Concept:': 'Olympic status of bodybuilding', 'Premise of the Question:': 'Invalid', 'Certainty_Estimation': 'Yes'}",
6,0,When did Meta move its headquarters to Austin?,"Meta has never had its headquarters in Austin. Its headquarters are located in Menlo Park, California. ","{'Explanation:': 'Meta has not officially moved its headquarters to Austin. In fact, there are reports that Meta has ditched its move-in plans and is trying to sublease its offices in Austin.', 'Answer:': 'Meta has not officially moved its headquarters to Austin.', 'Confidence Level:': '90%', 'Source:': 'The Washington Post - https://www.washingtonpost.com/business/2023/10/15/downtown-austin-real-estate-doom-loop/', 'Core Concept:': 'Meta headquarters location', 'Premise of the Question:': 'Invalid. The premise of the question is based on the assumption that Meta has already moved its headquarters to Austin, which is not the case.'}","{'Explanation:': 'Meta has not moved its headquarters to Austin. In fact, it has ditched its move-in plans and is now trying to sublease its offices in Austin.', 'Answer:': 'Meta has not moved its headquarters to Austin.', 'Confidence Level:': '100.0%', 'Source:': 'The Washington Post - https://www.washingtonpost.com/business/2023/10/15/downtown-austin-real-estate-doom-loop/', 'Core Concept:': 'Meta headquarters location', 'Premise of the Question:': 'Invalid. The premise of the question is invalid because Meta has not moved its headquarters to Austin.', 'Certainty_Estimation': 'Yes'}",100.0,"{'related_questions': [{'name': 'Is Meta not moving to Austin?', 'url': 'https://www.washingtonpost.com/business/2023/10/15/downtown-austin-real-estate-doom-loop/', 'snippet': 'Meta has ditched its move-in plans and is now trying to sublease 589,000 square feet of offices, 1,626 parking spots, 17 private balconies and a half-acre of green space.'}, {'name': 'When did Facebook move to Austin?', 'url': 'https://www.builtinaustin.com/2019/09/05/facebook-new-austin-office', 'snippet': ""Facebook has been in Austin since 2010, when it arrived in the city with just seven employees. Now Facebook has over 1,200 employees across multiple offices in Austin. This new office comes in addition to Facebook's previous Austin locations, and has room for over 1,550 employees.""}]}","{'Explanation:': 'Meta has not moved its headquarters to Austin. In fact, it has ditched its move-in plans and is now trying to sublease its offices in Austin.', 'Answer:': 'Meta has not moved its headquarters to Austin.', 'Confidence Level:': '100%', 'Source:': 'The Washington Post - https://www.washingtonpost.com/business/2023/10/15/downtown-austin-real-estate-doom-loop/', 'Core Concept:': 'Meta headquarters location', 'Premise of the Question:': 'Invalid. The premise of the question is invalid because Meta has not moved its headquarters to Austin.', 'Certainty_Estimation': 'Yes'}","{'Explanation:': 'Meta has not officially moved its headquarters to Austin. In fact, there are reports that Meta has ditched its move-in plans and is trying to sublease its office space in Austin.', 'Answer:': 'Meta has not officially moved its headquarters to Austin.', 'Confidence Level:': '90%', 'Source:': 'The Washington Post - https://www.washingtonpost.com/business/2023/10/15/downtown-austin-real-estate-doom-loop/', 'Core Concept:': 'Meta headquarters relocation', 'Premise of the Question:': 'Invalid', 'Certainty_Estimation': 'Yes'}",
